{
  "meta": {
    "schemaVersion": 1,
    "lastUpdated": "2026-10-13"
  },
  "site": {
    "title": "Joshua Angeles — Computer Engineering Student",
    "description": "Computer engineering student building embedded systems, mechanical CAD designs, and circuit prototypes. Siemens Solid Edge Certified Mechanical Associate.",
    "canonicalUrl": "https://bimbangbingbangbung-dotcom.github.io/CV-Web/",
    "ogImage": "./assets/og-image.png",
    "lang": "en",
    "themeColor": "#fbfbfa",
    "analytics": {
      "provider": "none",
      "domain": null
    }
  },
  "appearance": {
    "accent": "#0f6d66",
    "accentDark": "#5cc5ba"
  },
  "header": {
    "mode": "autohide",
    "hoverZoneHeight": 56,
    "hideDelayMs": 500,
    "showOnLoadHint": true,
    "discoverabilityHint": true,
    "showEditLink": true
  },
  "theme": {
    "default": "system",
    "toggleShortcut": "T"
  },
  "cv": {
    "path": "./assets/cv.pdf",
    "label": "Download CV"
  },
  "owner": {
    "fullName": "Joshua Niño C. Angeles",
    "headline": "Computer Engineering Student",
    "tagline": "I connect software logic with physical hardware — from embedded firmware to 3D mechanical design.",
    "shortBio": "Analytical computer engineering student with a multidisciplinary foundation spanning embedded systems programming, CAD mechanical design, and circuit prototyping. Siemens Solid Edge Certified Mechanical Associate (SSECMA) with formal Java programming credentials — a rare ability to integrate software logic with physical hardware engineering and 3D modeling.",
    "longBio": "I'm currently finishing my BS in Computer Engineering at STI Ortigas-Cainta College (2023–present). My thesis is an Arduino-based automated pet food weighing vending machine — receipt printing with stock monitoring — which combines firmware, circuit design, and mechanical assembly in one build.\n\nI started in the STEM strand, where our research on an automatic trash can decomposer turned food waste into fertilizer and won awards at SHS EXPO 2023. Since then I've built a 6-DOF robotic arm, a domestic cleaning robot prototype, and a solar-powered mobile charging system. I'm looking for an internship where I can work close to the metal — embedded systems, hardware prototyping, or mechanical design.",
    "location": "Cainta, Rizal, Philippines",
    "availability": {
      "label": "Open to internships and OJT",
      "show": true
    },
    "photo": "./assets/photo.jpg",
    "initials": "JA",
    "languages": ["Filipino (native)", "English (fluent)"],
    "interests": [
      "embedded systems",
      "robotics",
      "mechatronics",
      "CAD design",
      "circuit prototyping"
    ],
    "now": [
      {
        "text": "Finishing my thesis: Arduino pet food weighing vending machine"
      },
      {
        "text": "Building my Solid Edge mechanical design portfolio"
      },
      {
        "text": "Looking for an internship where I can work close to the metal"
      }
    ]
  },
  "sections": [
    {
      "id": "about",
      "label": "About",
      "enabled": true
    },
    {
      "id": "education",
      "label": "Education",
      "enabled": true
    },
    {
      "id": "skills",
      "label": "Skills",
      "enabled": true
    },
    {
      "id": "projects",
      "label": "Projects",
      "enabled": true
    },
    {
      "id": "experience",
      "label": "Experience",
      "enabled": true
    },
    {
      "id": "achievements",
      "label": "Achievements",
      "enabled": true
    },
    {
      "id": "publications",
      "label": "Publications",
      "enabled": false
    },
    {
      "id": "references",
      "label": "References",
      "enabled": true
    },
    {
      "id": "contact",
      "label": "Contact",
      "enabled": true
    }
  ],
  "education": [
    {
      "institution": "STI Ortigas-Cainta College",
      "degree": "BS Computer Engineering",
      "location": "Cainta, Rizal, Philippines",
      "start": "2023-08",
      "end": "Present",
      "gpa": null,
      "coursework": [
        "Embedded systems & microcontrollers",
        "Digital logic circuits",
        "Electrical schematics & circuit design",
        "3D mechanical CAD (Solid Edge)"
      ],
      "honors": []
    },
    {
      "institution": "STI Ortigas-Cainta College",
      "degree": "Senior High School — STEM Strand",
      "location": "Cainta, Rizal, Philippines",
      "start": "2021-07",
      "end": "2023-07",
      "gpa": null,
      "coursework": [],
      "honors": ["Graduated with Honors"]
    }
  ],
  "skills": [
    {
      "group": "Programming",
      "items": [
        {
          "name": "C++",
          "level": "intermediate",
          "note": "embedded systems & microcontrollers"
        },
        {
          "name": "Java",
          "level": "intermediate",
          "note": "Oracle-credential fundamentals"
        }
      ]
    },
    {
      "group": "Mechanical Design (CAD)",
      "items": [
        {
          "name": "3D CAD modeling & assemblies",
          "level": "advanced",
          "note": "Siemens Solid Edge — SSECMA certified"
        }
      ]
    },
    {
      "group": "Electronics",
      "items": [
        {
          "name": "Circuit design & drafting",
          "level": "intermediate",
          "note": "electrical schematics"
        },
        {
          "name": "Digital electronics",
          "level": "intermediate",
          "note": "design, simulation & testing"
        }
      ]
    },
    {
      "group": "Hardware Prototyping",
      "items": [
        {
          "name": "Robotics prototyping",
          "level": "advanced",
          "note": "6-DOF arm & domestic cleaning robot"
        },
        {
          "name": "Solar-powered charging systems",
          "level": "intermediate",
          "note": "mobile device charging"
        }
      ]
    },
    {
      "group": "Soft Skills",
      "items": [
        {
          "name": "Initiative",
          "level": null,
          "note": "takes the lead in group projects and tasks"
        },
        {
          "name": "Hardworking",
          "level": null,
          "note": "consistently meets strict project deadlines"
        },
        {
          "name": "Adaptability",
          "level": null,
          "note": "quickly learns and adapts to any environment"
        },
        {
          "name": "Teamwork",
          "level": null,
          "note": "collaborates to troubleshoot hardware issues"
        },
        {
          "name": "Time Management",
          "level": null,
          "note": "prioritizes concurrent tasks effectively"
        }
      ]
    }
  ],
  "projects": [
    {
      "title": "Automated Pet Food Weighing Vending Machine",
      "description": "My undergraduate thesis: an Arduino-based vending machine that weighs and dispenses pet food, prints receipts, and monitors stock levels — firmware, wiring, and mechanics in one build.",
      "role": "Thesis project — firmware & systems design",
      "year": "2026",
      "tech": ["Arduino", "C++", "Load cell", "Receipt printer"],
      "links": [],
      "image": null,
      "featured": true,
      "detail": null
    },
    {
      "title": "6-DOF Robotic Arm",
      "description": "A six-degree-of-freedom robotic arm I designed and built — structure, joint actuation, and control wiring, from mechanical assembly to embedded control.",
      "role": "Design & build — mechanical + controls",
      "year": "2023",
      "tech": ["Microcontrollers", "C++", "Mechatronics"],
      "links": [],
      "image": null,
      "featured": true,
      "detail": null
    },
    {
      "title": "Domestic Cleaning Robot Prototype",
      "description": "A prototype domestic cleaning robot — chassis, drive, and cleaning mechanism integrated on a microcontroller platform.",
      "role": "Design & build (prototype)",
      "year": "2023",
      "tech": ["Microcontrollers", "Robotics", "Prototyping"],
      "links": [],
      "image": null,
      "featured": false,
      "detail": null
    },
    {
      "title": "Solar-Powered Mobile Charging System",
      "description": "A solar-powered charging system for mobile devices — harvesting, regulating, and delivering power for charging on the go.",
      "role": "Design & build",
      "year": "2023",
      "tech": ["Solar power", "Charge regulation", "USB output"],
      "links": [],
      "image": null,
      "featured": false,
      "detail": null
    },
    {
      "title": "Miniature House with Working Lights",
      "description": "A scale-model house with a fully wired lighting circuit — built for SHS EXPO 2023, where it placed 2nd Best in Product (Physics).",
      "role": "Build & wiring",
      "year": "2023",
      "tech": ["Wiring", "Lighting circuits"],
      "links": [],
      "image": null,
      "featured": false,
      "detail": null
    }
  ],
  "experience": [
    {
      "org": "Association of Computer Engineering Students (STI OrCa)",
      "role": "Speaker & Participant",
      "location": "Metro Manila, Philippines",
      "start": "2026-05",
      "end": "Present",
      "type": "organization",
      "description": "Academic technology experience through my college organization — sharing CAD skills with fellow students and joining university-wide tech events.",
      "highlights": [
        "Speaker — Solid Edge Workshop organized by ACES STI OrCa",
        "Participant — IoT Competition, University of Makati",
        "Attendee — Engenium Cup, De La Salle University"
      ]
    }
  ],
  "achievements": [
    {
      "title": "Siemens Solid Edge Certified Mechanical Associate",
      "issuer": "Siemens",
      "date": "2025-12",
      "category": "certification",
      "url": null
    },
    {
      "title": "Oracle Java Fundamentals Certification",
      "issuer": "Oracle",
      "date": "2025-12",
      "category": "certification",
      "url": null
    },
    {